guid,published_et,published_utc,captured_utc,delay_seconds,title,link
9687583,2026-07-21 14:13:09,2026-07-21 18:13:09,2026-07-21 20:38:53,8744.3,Erbil International Airport has been closed due to recent rocket and drone attacks in the Kurdistan Region of Iraq - Tasnim News citing Iraqi sources,https://www.financialjuice.com/News/9687583/Erbil-International-Airport-has-been-closed-due-to-recent-rocket-and-drone-attacks-in-the-Kurdistan-Region-of-Iraq---Tasnim-News-citing-Iraqi-sources-.aspx
9687587,2026-07-21 14:24:42,2026-07-21 18:24:42,2026-07-21 20:38:53,8051.3,Goldman Sachs creates private markets platform - CNBC $GS,https://www.financialjuice.com/News/9687587/Goldman-Sachs-creates-private-markets-platform---CNBC-GS.aspx
9687590,2026-07-21 14:26:01,2026-07-21 18:26:01,2026-07-21 20:38:53,7972.3,Goldman Sachs platform to let some clients invest in private companies - CNBC $GS,https://www.financialjuice.com/News/9687590/Goldman-Sachs-platform-to-let-some-clients-invest-in-private-companies---CNBC-GS.aspx
9687591,2026-07-21 14:28:48,2026-07-21 18:28:48,2026-07-21 20:38:53,7805.3,LIVE: US Sec. of Defense Hegseth testifies before Senate on Trump's supplemental funding request,https://www.financialjuice.com/News/9687591/LIVE-US-Sec-of-Defense-Hegseth-testifies-before-Senate-on-Trumps-supplemental-funding-request.aspx
9687597,2026-07-21 14:31:09,2026-07-21 18:31:09,2026-07-21 20:38:53,7664.3,"NYMEX WTI crude August futures settle at $84.91 a barrel, up $1.68, 2.02%.",https://www.financialjuice.com/News/9687597/NYMEX-WTI-crude-August-futures-settle-at-8491-a-barrel-up-168-202.aspx
9687598,2026-07-21 14:31:22,2026-07-21 18:31:22,2026-07-21 20:38:53,7651.3,NYMEX Diesel August futures settle at $4.1266 a gallon.,https://www.financialjuice.com/News/9687598/NYMEX-Diesel-August-futures-settle-at-41266-a-gallon.aspx
9687599,2026-07-21 14:31:37,2026-07-21 18:31:37,2026-07-21 20:38:53,7636.3,NYMEX Gasoline August futures settle at $3.4059 a gallon.,https://www.financialjuice.com/News/9687599/NYMEX-Gasoline-August-futures-settle-at-34059-a-gallon.aspx
9687610,2026-07-21 14:32:37,2026-07-21 18:32:37,2026-07-21 20:38:53,7576.3,NYMEX Natural Gas August futures settle at $2.8650/mmbtu,https://www.financialjuice.com/News/9687610/NYMEX-Natural-Gas-August-futures-settle-at-28650mmbtu.aspx
9687614,2026-07-21 14:37:44,2026-07-21 18:37:44,2026-07-21 20:38:53,7269.3,Reports that the Israeli embassy in Manama had been hit claim that the information was not yet confirmed and that this incident is under investigation. - Fars News citing Israeli Channel 14,https://www.financialjuice.com/News/9687614/Reports-that-the-Israeli-embassy-in-Manama-had-been-hit-claim-that-the-information-was-not-yet-confirmed-and-that-this-incident-is-under-investigation---Fars-News-citing--Israeli-Channel-14.aspx
9687615,2026-07-21 14:40:28,2026-07-21 18:40:28,2026-07-21 20:38:53,7105.3,US Sec. of Defense Hegseth to the Senate panel: The Pentagon needs funds urgently.,https://www.financialjuice.com/News/9687615/US-Sec-of-Defense-Hegseth-to-the-Senate-panel-The-Pentagon-needs-funds-urgently.aspx
9687616,2026-07-21 14:40:57,2026-07-21 18:40:57,2026-07-21 20:38:53,7076.3,US Sec. of Defense Hegseth: Request $2b for equipment lost or damaged in combat.,https://www.financialjuice.com/News/9687616/US-Sec-of-Defense-Hegseth-Request-2b-for-equipment-lost-or-damaged-in-combat.aspx
9687617,2026-07-21 14:41:30,2026-07-21 18:41:30,2026-07-21 20:38:53,7043.3,US Sec. of Defense Hegseth: Senate must pass $67b supplemental.,https://www.financialjuice.com/News/9687617/US-Sec-of-Defense-Hegseth-Senate-must-pass-67b-supplemental.aspx
9687618,2026-07-21 14:42:51,2026-07-21 18:42:51,2026-07-21 20:38:53,6962.3,US Sec. of Defense Hegseth: Request $1.5b for mission-critical fuel shortfalls.,https://www.financialjuice.com/News/9687618/US-Sec-of-Defense-Hegseth-Request-15b-for-mission-critical-fuel-shortfalls.aspx
9687630,2026-07-21 14:47:09,2026-07-21 18:47:09,2026-07-21 20:38:53,6704.3,"Brent crude futures settle at $91.01/bbl, up $1.79, 2.01%.",https://www.financialjuice.com/News/9687630/Brent-crude-futures-settle-at-9101bbl-up-179-201.aspx
9687634,2026-07-21 14:49:13,2026-07-21 18:49:13,2026-07-21 20:38:53,6580.3,Iraq’s Erbil airport resumes flights after temporary suspension - Iraqi State News Agency,https://www.financialjuice.com/News/9687634/Iraqs-Erbil-airport-resumes-flights-after-temporary-suspension---Iraqi-State-News-Agency.aspx
9687650,2026-07-21 15:08:24,2026-07-21 19:08:24,2026-07-21 20:38:53,5429.3,UK's PM Burnham approves use of uk bases for some us strikes on Iran.,https://www.financialjuice.com/News/9687650/UKs-PM-Burnham-approves-use-of-uk-bases-for-some-us-strikes-on-Iran.aspx
9687659,2026-07-21 15:16:09,2026-07-21 19:16:09,2026-07-21 20:38:53,4964.3,Iraq's Oil Minister: Total value of deals signed between the Iraqi oil ministry and US companies during prime minister's visit are estimated at $200 bln - Iraq's State TV,https://www.financialjuice.com/News/9687659/Iraqs-Oil-Minister-Total-value-of-deals-signed-between-the-Iraqi-oil-ministry-and-US-companies-during-prime-ministers-visit-are-estimated-at-200-bln---Iraqs-State-TV.aspx
9687664,2026-07-21 15:17:29,2026-07-21 19:17:29,2026-07-21 20:38:53,4884.3,Iraq's Oil Minister: The agreements with US companies will add significant production capacity and investment in associated gas.,https://www.financialjuice.com/News/9687664/Iraqs-Oil-Minister-The-agreements-with-US-companies-will-add-significant-production-capacity-and-investment-in-associated-gas.aspx
9687665,2026-07-21 15:21:28,2026-07-21 19:21:28,2026-07-21 20:38:53,4645.3,Wednesday FX Options Expiries,https://www.financialjuice.com/News/9687665/Wednesday-FX-Options-Expiries.aspx
9687674,2026-07-21 15:31:00,2026-07-21 19:31:00,2026-07-21 20:38:53,4073.3,Iraq's Oil Minister: The country’s production capacity is at 4.8 million barrels of oil per day,https://www.financialjuice.com/News/9687674/Iraqs-Oil-Minister-The-countrys-production-capacity-is-at-48-million-barrels-of-oil-per-day.aspx
9687687,2026-07-21 15:40:44,2026-07-21 19:40:44,2026-07-21 20:38:53,3489.3,"The US to set new tariffs on trading partners, citing forced labor, by Friday, with a stopgap to expire.",https://www.financialjuice.com/News/9687687/The-US-to-set-new-tariffs-on-trading-partners-citing-forced-labor-by-Friday-with-a-stopgap-to-expire.aspx
9687692,2026-07-21 15:50:30,2026-07-21 19:50:30,2026-07-21 20:38:53,2903.3,MOC Imbalance,https://www.financialjuice.com/News/9687692/MOC-Imbalance.aspx
9687693,2026-07-21 15:50:46,2026-07-21 19:50:46,2026-07-21 20:38:53,2887.3,US Sec. of Defense Hegseth on Iran: The war has cost $37.5 billion so far.,https://www.financialjuice.com/News/9687693/US-Sec-of-Defense-Hegseth-on-Iran-The-war-has-cost-375-billion-so-far.aspx
9687707,2026-07-21 16:07:14,2026-07-21 20:07:14,2026-07-21 20:38:53,1899.3,$SMCI Super Micro Computer Q4 Update,https://www.financialjuice.com/News/9687707/SMCI-Super-Micro-Computer-Q4-Update.aspx
9687719,2026-07-21 16:26:24,2026-07-21 20:26:24,2026-07-21 20:38:53,749.3,US Energy dept. set to host AI-related event on Wednesday,https://www.financialjuice.com/News/9687719/US-Energy-dept-set-to-host-AI-related-event-on-Wednesday.aspx
9687720,2026-07-21 16:27:30,2026-07-21 20:27:30,2026-07-21 20:38:53,683.3,Details of $200 mln effort to be unveiled as soon as Wednesday.,https://www.financialjuice.com/News/9687720/Details-of-200-mln-effort-to-be-unveiled-as-soon-as-Wednesday.aspx
9687721,2026-07-21 16:27:48,2026-07-21 20:27:48,2026-07-21 20:38:53,665.3,"Oklo, X-Energy join Trump's bid to speed nuclear reactors for AI.",https://www.financialjuice.com/News/9687721/Oklo-X-Energy-join-Trumps-bid-to-speed-nuclear-reactors-for-AI.aspx
9687743,2026-07-21 16:39:58,2026-07-21 20:39:58,2026-07-21 23:43:49,11031.8,"US API Crude Oil Stock Change Actual 2.6M (Forecast -1.5M, Previous -0.564M)",https://www.financialjuice.com/News/9687743/US-API-Crude-Oil-Stock-Change-Actual-26M-Forecast--15M-Previous--0564M.aspx?xy=rss
9687745,2026-07-21 16:41:57,2026-07-21 20:41:57,2026-07-21 23:43:49,10912.8,"US API Distillate Stock Change Actual 1.759M (Forecast -, Previous 2.3M)",https://www.financialjuice.com/News/9687745/US-API-Distillate-Stock-Change-Actual-1759M-Forecast---Previous-23M.aspx?xy=rss
9687754,2026-07-21 16:47:15,2026-07-21 20:47:15,2026-07-21 23:43:49,10594.8,"US API Gasoline Stock Change Actual -1.379M (Forecast -, Previous -1.664M)",https://www.financialjuice.com/News/9687754/US-API-Gasoline-Stock-Change-Actual--1379M-Forecast---Previous--1664M.aspx?xy=rss
9687755,2026-07-21 16:47:16,2026-07-21 20:47:16,2026-07-21 23:43:49,10593.8,"US API Cushing Stock Change Actual -0.737M (Forecast -, Previous -0.238M)",https://www.financialjuice.com/News/9687755/US-API-Cushing-Stock-Change-Actual--0737M-Forecast---Previous--0238M.aspx?xy=rss
9687756,2026-07-21 16:52:07,2026-07-21 20:52:07,2026-07-21 23:43:49,10302.8,Iran's Top Joint Military Command: All US and its allies interests in the region will be targeted if US attacks iran's nuclear sites - Iranian State TV,https://www.financialjuice.com/News/9687756/Irans-Top-Joint-Military-Command-All-US-and-its-allies-interests-in-the-region-will-be-targeted-if-US-attacks-irans-nuclear-sites---Iranian-State-TV.aspx?xy=rss
9687757,2026-07-21 16:54:54,2026-07-21 20:54:54,2026-07-21 23:43:49,10135.8,"Iran's Top Joint Military Command: If US attacks Iran's nuclear sites, it will be an expansion of war in the region - Iranian State TV",https://www.financialjuice.com/News/9687757/Irans-Top-Joint-Military-Command-If-US-attacks-Irans-nuclear-sites-it-will-be-an-expansion-of-war-in-the-region---Iranian-State-TV.aspx?xy=rss
9687758,2026-07-21 16:59:27,2026-07-21 20:59:27,2026-07-21 23:43:49,9862.8,Iran vows a powerful strike if the US hits nuclear sites - IRIB,https://www.financialjuice.com/News/9687758/Iran-vows-a-powerful-strike-if-the-US-hits-nuclear-sites---IRIB.aspx?xy=rss
9687759,2026-07-21 17:00:00,2026-07-21 21:00:00,2026-07-21 23:43:49,9829.8,"S. Korean PPI YoY Actual 8.6% (Forecast -, Previous 8.5%)",https://www.financialjuice.com/News/9687759/S-Korean-PPI-YoY-Actual-86-Forecast---Previous-85.aspx?xy=rss
9687800,2026-07-21 17:49:56,2026-07-21 21:49:56,2026-07-21 23:43:49,6833.8,Trump administration weighs banning imports of military-grade drones: Federal Communications Commission,https://www.financialjuice.com/News/9687800/Trump-administration-weighs-banning-imports-of-military-grade-drones-Federal-Communications-Commission.aspx?xy=rss
9687801,2026-07-21 17:52:56,2026-07-21 21:52:56,2026-07-21 23:43:49,6653.8,UK PM Burnham names Lucy Rigby city minister,https://www.financialjuice.com/News/9687801/UK-PM-Burnham-names-Lucy-Rigby-city-minister.aspx?xy=rss
9687803,2026-07-21 18:01:15,2026-07-21 22:01:15,2026-07-21 23:43:49,6154.8,"White House to divert billions in research funding to AI, away from universities - WSJ",https://www.financialjuice.com/News/9687803/White-House-to-divert-billions-in-research-funding-to-AI-away-from-universities---WSJ.aspx?xy=rss
9687833,2026-07-21 18:42:05,2026-07-21 22:42:05,2026-07-21 23:43:49,3704.8,"South Korea June Producer Price Index rises 8.6% y/y, steady from May: central bank",https://www.financialjuice.com/News/9687833/South-Korea-June-Producer-Price-Index-rises-86-yy-steady-from-May-central-bank.aspx?xy=rss
9687834,2026-07-21 18:42:05,2026-07-21 22:42:05,2026-07-21 23:43:49,3704.8,S.Korea June producer price index unchanged month on month vs May's 1% rise: central bank,https://www.financialjuice.com/News/9687834/SKorea-June-producer-price-index-unchanged-month-on-month-vs-Mays-1-rise-central-bank.aspx?xy=rss
9687832,2026-07-21 18:42:24,2026-07-21 22:42:24,2026-07-21 23:43:49,3685.8,"S. Korean PPI MoM Actual 0.0% (Forecast -, Previous 0.8%)",https://www.financialjuice.com/News/9687832/S-Korean-PPI-MoM-Actual-00-Forecast---Previous-08.aspx?xy=rss
9687842,2026-07-21 18:54:42,2026-07-21 22:54:42,2026-07-21 23:43:49,2947.8,"Trump: Starting Aug. 1, 2026, all generic drugs entering US will maintain zero percent tariff for two years",https://www.financialjuice.com/News/9687842/Trump-Starting-Aug-1-2026-all-generic-drugs-entering-US-will-maintain-zero-percent-tariff-for-two-years.aspx?xy=rss
9687843,2026-07-21 18:55:36,2026-07-21 22:55:36,2026-07-21 23:43:49,2893.8,"Trump: After two years, tariff to rise to 100% for one year, then 200% afterward",https://www.financialjuice.com/News/9687843/Trump-After-two-years-tariff-to-rise-to-100-for-one-year-then-200-afterward.aspx?xy=rss
9687884,2026-07-21 19:33:26,2026-07-21 23:33:26,2026-07-21 23:43:49,623.8,Centcom: forces started hitting military targets in Iran at 7 p.m. ET today for 11th straight night,https://www.financialjuice.com/News/9687884/Centcom-forces-started-hitting-military-targets-in-Iran-at-7-pm-ET-today-for-11th-straight-night.aspx?xy=rss
9687889,2026-07-21 19:50:01,2026-07-21 23:50:01,2026-07-22 08:01:17,29476.0,"Japanese Imports YoY Actual 25.4% (Forecast 21.2%, Previous 12.5%)",https://www.financialjuice.com/News/9687889/Japanese-Imports-YoY-Actual-254-Forecast-212-Previous-125.aspx?xy=rss
9687890,2026-07-21 19:50:01,2026-07-21 23:50:01,2026-07-22 08:01:17,29476.0,"Japanese Exports YoY Actual 19.3% (Forecast 18%, Previous 16.8%)",https://www.financialjuice.com/News/9687890/Japanese-Exports-YoY-Actual-193-Forecast-18-Previous-168.aspx?xy=rss
9687891,2026-07-21 19:50:01,2026-07-21 23:50:01,2026-07-22 08:01:17,29476.0,"Japanese Total Trade Balance Actual -406.9B (Forecast -120B, Previous -391.8B)",https://www.financialjuice.com/News/9687891/Japanese-Total-Trade-Balance-Actual--4069B-Forecast--120B-Previous--3918B.aspx?xy=rss
9687892,2026-07-21 19:50:03,2026-07-21 23:50:03,2026-07-22 08:01:17,29474.0,Japan June exports to EU rise 20.3% year over year: MOF,https://www.financialjuice.com/News/9687892/Japan-June-exports-to-EU-rise-203-year-over-year-MOF.aspx?xy=rss
9687893,2026-07-21 19:50:03,2026-07-21 23:50:03,2026-07-22 08:01:17,29474.0,Japan June trade deficit at 406.9 billion yen: Ministry of Finance (poll: 120 billion yen),https://www.financialjuice.com/News/9687893/Japan-June-trade-deficit-at-4069-billion-yen-Ministry-of-Finance-poll-120-billion-yen.aspx?xy=rss
9687894,2026-07-21 19:50:03,2026-07-21 23:50:03,2026-07-22 08:01:17,29474.0,Japan June exports to China rise 17.6% year/year: MOF,https://www.financialjuice.com/News/9687894/Japan-June-exports-to-China-rise-176-yearyear-MOF.aspx?xy=rss
9687895,2026-07-21 19:50:03,2026-07-21 23:50:03,2026-07-22 08:01:17,29474.0,"Japan June imports climb 25.4% year/year, Ministry of Finance: poll expected 21.0%",https://www.financialjuice.com/News/9687895/Japan-June-imports-climb-254-yearyear-Ministry-of-Finance-poll-expected-210.aspx?xy=rss
9687896,2026-07-21 19:50:03,2026-07-21 23:50:03,2026-07-22 08:01:17,29474.0,Japan June exports to U.S. rise 13% year on year: MOF,https://www.financialjuice.com/News/9687896/Japan-June-exports-to-US-rise-13-year-on-year-MOF.aspx?xy=rss
9687897,2026-07-21 19:50:03,2026-07-21 23:50:03,2026-07-22 08:01:17,29474.0,"Japan June exports rise 19.3% year on year, Ministry of Finance says (poll: +18.6%)",https://www.financialjuice.com/News/9687897/Japan-June-exports-rise-193-year-on-year-Ministry-of-Finance-says-poll-186.aspx?xy=rss
9687898,2026-07-21 19:50:03,2026-07-21 23:50:03,2026-07-22 08:01:17,29474.0,Japan June exports to Asia climb 22.7% year on year: MOF,https://www.financialjuice.com/News/9687898/Japan-June-exports-to-Asia-climb-227-year-on-year-MOF.aspx?xy=rss
9687899,2026-07-21 20:00:02,2026-07-22 00:00:02,2026-07-22 08:01:17,28875.0,South Korea Vice Finance Minister: urges exporters to repatriate more dollars earned overseas,https://www.financialjuice.com/News/9687899/South-Korea-Vice-Finance-Minister-urges-exporters-to-repatriate-more-dollars-earned-overseas.aspx?xy=rss
9687900,2026-07-21 20:00:02,2026-07-22 00:00:02,2026-07-22 08:01:17,28875.0,South Korea vice finance minister: herd behavior easing in dollar-won trading,https://www.financialjuice.com/News/9687900/South-Korea-vice-finance-minister-herd-behavior-easing-in-dollar-won-trading.aspx?xy=rss
9687901,2026-07-21 20:00:03,2026-07-22 00:00:03,2026-07-22 08:01:17,28874.0,South Korea vice finance minister: ample policy space secured to stabilize currency market if required,https://www.financialjuice.com/News/9687901/South-Korea-vice-finance-minister-ample-policy-space-secured-to-stabilize-currency-market-if-required.aspx?xy=rss
9687925,2026-07-21 20:05:02,2026-07-22 00:05:02,2026-07-22 08:01:17,28575.0,"Iranian state TV: air defense activity reported in western, eastern and northeastern Tehran",https://www.financialjuice.com/News/9687925/Iranian-state-TV-air-defense-activity-reported-in-western-eastern-and-northeastern-Tehran.aspx?xy=rss
9687926,2026-07-21 20:05:16,2026-07-22 00:05:16,2026-07-22 08:01:17,28561.0,Justice Department proposes June 2027 trial start in Maduro case: court document,https://www.financialjuice.com/News/9687926/Justice-Department-proposes-June-2027-trial-start-in-Maduro-case-court-document.aspx?xy=rss
9687927,2026-07-21 20:08:24,2026-07-22 00:08:24,2026-07-22 08:01:17,28373.0,Iran's semi-official Fars: East Azerbaijan authorities report U.S. airstrike on military site near Tabriz,https://www.financialjuice.com/News/9687927/Irans-semi-official-Fars-East-Azerbaijan-authorities-report-US-airstrike-on-military-site-near-Tabriz.aspx?xy=rss
9687928,2026-07-21 20:08:41,2026-07-22 00:08:41,2026-07-22 08:01:17,28356.0,China PBOC likely to set yuan midpoint at 6.7737 per dollar: estimate,https://www.financialjuice.com/News/9687928/China-PBOC-likely-to-set-yuan-midpoint-at-67737-per-dollar-estimate.aspx?xy=rss
9687929,2026-07-21 20:13:17,2026-07-22 00:13:17,2026-07-22 08:01:17,28080.0,Trump to attend dignified transfer at Dover Air Force Base Wednesday: White House,https://www.financialjuice.com/News/9687929/Trump-to-attend-dignified-transfer-at-Dover-Air-Force-Base-Wednesday-White-House.aspx?xy=rss
9687938,2026-07-21 20:31:06,2026-07-22 00:31:06,2026-07-22 08:01:17,27011.0,State Department: Deputy Secretary Landau to meet Chinese executive vice foreign minister Ma Zhaoxu Wednesday,https://www.financialjuice.com/News/9687938/State-Department-Deputy-Secretary-Landau-to-meet-Chinese-executive-vice-foreign-minister-Ma-Zhaoxu-Wednesday.aspx?xy=rss
9687941,2026-07-21 20:37:37,2026-07-22 00:37:37,2026-07-22 08:01:17,26620.0,U.S. Central Command: completes 11th straight night of strikes on Iran,https://www.financialjuice.com/News/9687941/US-Central-Command-completes-11th-straight-night-of-strikes-on-Iran.aspx?xy=rss
9687956,2026-07-21 20:55:05,2026-07-22 00:55:05,2026-07-22 08:01:17,25572.0,Trump approves historic nuclear agreement with Saudi Arabia - WSJ,https://www.financialjuice.com/News/9687956/Trump-approves-historic-nuclear-agreement-with-Saudi-Arabia---WSJ.aspx?xy=rss
9687959,2026-07-21 21:00:39,2026-07-22 01:00:39,2026-07-22 08:01:17,25238.0,Japan finance minister Katayama: declines to comment on specific forex levels,https://www.financialjuice.com/News/9687959/Japan-finance-minister-Katayama-declines-to-comment-on-specific-forex-levels.aspx?xy=rss
9687960,2026-07-21 21:00:39,2026-07-22 01:00:39,2026-07-22 08:01:17,25238.0,Taiwan shares climb over 2%,https://www.financialjuice.com/News/9687960/Taiwan-shares-climb-over-2.aspx?xy=rss
9687961,2026-07-21 21:01:00,2026-07-22 01:01:00,2026-07-22 08:01:17,25217.0,Japan Finance Minister Katayama: will take necessary steps on forex as required,https://www.financialjuice.com/News/9687961/Japan-Finance-Minister-Katayama-will-take-necessary-steps-on-forex-as-required.aspx?xy=rss
9687962,2026-07-21 21:01:31,2026-07-22 01:01:31,2026-07-22 08:01:17,25186.0,Japan Finmin Katayama: US-Iran situation has grown very challenging,https://www.financialjuice.com/News/9687962/Japan-Finmin-Katayama-US-Iran-situation-has-grown-very-challenging.aspx?xy=rss
9687975,2026-07-21 21:08:13,2026-07-22 01:08:13,2026-07-22 08:01:17,24784.0,"Trump administration to provide Congress agreement on Saudi nuclear power lacking safeguards, sources say",https://www.financialjuice.com/News/9687975/Trump-administration-to-provide-Congress-agreement-on-Saudi-nuclear-power-lacking-safeguards-sources-say.aspx?xy=rss
9687976,2026-07-21 21:10:17,2026-07-22 01:10:17,2026-07-22 08:01:17,24660.0,Taiwan’s Wistron opens Texas facility to produce Nvidia’s first Grace Blackwell ultra superchip in U.S.,https://www.financialjuice.com/News/9687976/Taiwans-Wistron-opens-Texas-facility-to-produce-Nvidias-first-Grace-Blackwell-ultra-superchip-in-US.aspx?xy=rss
9687977,2026-07-21 21:10:37,2026-07-22 01:10:37,2026-07-22 08:01:17,24640.0,Taiwan’s Wistron: It will also produce Nvidia’s Vera Rubin superchip at Texas facility,https://www.financialjuice.com/News/9687977/Taiwans-Wistron-It-will-also-produce-Nvidias-Vera-Rubin-superchip-at-Texas-facility.aspx?xy=rss
9687978,2026-07-21 21:10:48,2026-07-22 01:10:48,2026-07-22 08:01:17,24629.0,"Taiwan's Wistron: Texas site marks $700 million investment, covers 324,000 square feet",https://www.financialjuice.com/News/9687978/Taiwans-Wistron-Texas-site-marks-700-million-investment-covers-324000-square-feet.aspx?xy=rss
9687992,2026-07-21 21:20:08,2026-07-22 01:20:08,2026-07-22 08:01:17,24069.0,China central bank injects 76 billion yuan via 7-day reverse repos at 1.40%: statement,https://www.financialjuice.com/News/9687992/China-central-bank-injects-76-billion-yuan-via-7-day-reverse-repos-at-140-statement.aspx?xy=rss
9688097,2026-07-21 22:05:05,2026-07-22 02:05:05,2026-07-22 08:01:17,21372.0,China: 6.95 million new urban jobs created nationwide - Xinhua,https://www.financialjuice.com/News/9688097/China-695-million-new-urban-jobs-created-nationwide---Xinhua.aspx?xy=rss
9688099,2026-07-21 22:11:57,2026-07-22 02:11:57,2026-07-22 08:01:17,20960.0,US House approves temporary funding bill to support federal agencies through November elections,https://www.financialjuice.com/News/9688099/US-House-approves-temporary-funding-bill-to-support-federal-agencies-through-November-elections.aspx?xy=rss
9688100,2026-07-21 23:01:27,2026-07-22 03:01:27,2026-07-22 08:01:17,17990.0,"China foreign minister at ASEAN meeting: China to keep working with ASEAN on peace, development, cooperation and mutual benefit principles",https://www.financialjuice.com/News/9688100/China-foreign-minister-at-ASEAN-meeting-China-to-keep-working-with-ASEAN-on-peace-development-cooperation-and-mutual-benefit-principles.aspx?xy=rss
9688101,2026-07-21 23:01:58,2026-07-22 03:01:58,2026-07-22 08:01:17,17959.0,China foreign minister at ASEAN meeting: Beijing ready to deepen collaboration for regional people's benefit - via translator,https://www.financialjuice.com/News/9688101/China-foreign-minister-at-ASEAN-meeting-Beijing-ready-to-deepen-collaboration-for-regional-peoples-benefit---via-translator.aspx?xy=rss
9688145,2026-07-21 23:18:30,2026-07-22 03:18:30,2026-07-22 08:01:17,16967.0,Trump-backed Jay Feely triumphs in GOP primary in Arizona's 1st district: Politico,https://www.financialjuice.com/News/9688145/Trump-backed-Jay-Feely-triumphs-in-GOP-primary-in-Arizonas-1st-district-Politico.aspx?xy=rss
9688146,2026-07-21 23:22:20,2026-07-22 03:22:20,2026-07-22 08:01:17,16737.0,Thomas Feely secures Republican nomination for U.S. House in Arizona’s 1st congressional district: AP,https://www.financialjuice.com/News/9688146/Thomas-Feely-secures-Republican-nomination-for-US-House-in-Arizonas-1st-congressional-district-AP.aspx?xy=rss
9688147,2026-07-21 23:26:36,2026-07-22 03:26:36,2026-07-22 08:01:17,16481.0,Former pro football player Jay Feely wins Republican primary for Arizona's 1st district House seat: US media projects,https://www.financialjuice.com/News/9688147/Former-pro-football-player-Jay-Feely-wins-Republican-primary-for-Arizonas-1st-district-House-seat-US-media-projects.aspx?xy=rss
9688160,2026-07-21 23:39:34,2026-07-22 03:39:34,2026-07-22 08:01:17,15703.0,China finance ministry offers 10-year bonds at 1.7147% yield: traders,https://www.financialjuice.com/News/9688160/China-finance-ministry-offers-10-year-bonds-at-17147-yield-traders.aspx?xy=rss
9688161,2026-07-21 23:41:20,2026-07-22 03:41:20,2026-07-22 08:01:17,15597.0,China Finance Ministry auctions 3-month bills at 0.9341% yield: traders,https://www.financialjuice.com/News/9688161/China-Finance-Ministry-auctions-3-month-bills-at-09341-yield-traders.aspx?xy=rss
9688206,2026-07-22 00:21:14,2026-07-22 04:21:14,2026-07-22 08:01:17,13203.0,L Wilson did not libel colleague in social media posts: judge,https://www.financialjuice.com/News/9688206/L-Wilson-did-not-libel-colleague-in-social-media-posts-judge.aspx?xy=rss
9688228,2026-07-22 01:00:55,2026-07-22 05:00:55,2026-07-22 08:01:17,10822.0,Australian court finds actor Rebel Wilson did not libel colleague in social media posts: judge,https://www.financialjuice.com/News/9688228/Australian-court-finds-actor-Rebel-Wilson-did-not-libel-colleague-in-social-media-posts-judge.aspx?xy=rss
9688229,2026-07-22 01:00:56,2026-07-22 05:00:56,2026-07-22 08:01:17,10821.0,Ukraine's outgoing commander in chief: Ukraine recaptured 700 square kilometers of land this year,https://www.financialjuice.com/News/9688229/Ukraines-outgoing-commander-in-chief-Ukraine-recaptured-700-square-kilometers-of-land-this-year.aspx?xy=rss
9688238,2026-07-22 01:01:58,2026-07-22 05:01:58,2026-07-22 08:01:17,10759.0,"Russia’s defence ministry: forces strike Ukrainian ports, two ships damaged",https://www.financialjuice.com/News/9688238/Russias-defence-ministry-forces-strike-Ukrainian-ports-two-ships-damaged.aspx?xy=rss
9688241,2026-07-22 01:02:40,2026-07-22 05:02:40,2026-07-22 08:01:17,10717.0,UK's Downing Street: single bus fares cut by up to a third from January,https://www.financialjuice.com/News/9688241/UKs-Downing-Street-single-bus-fares-cut-by-up-to-a-third-from-January.aspx?xy=rss
