guid,published_et,published_utc,captured_utc,delay_seconds,title,link
9689542,2026-07-22 17:08:14,2026-07-22 21:08:14,2026-07-22 21:41:34,2000.4,Iran’s semi-official Mehr cites Khuzestan province official: location near Ahwaz hit in US missile strike,https://www.financialjuice.com/News/9689542/Irans-semi-official-Mehr-cites-Khuzestan-province-official-location-near-Ahwaz-hit-in-US-missile-strike.aspx
9689543,2026-07-22 17:11:14,2026-07-22 21:11:14,2026-07-22 21:41:34,1820.4,"UKMTO: Incident reported 70 nautical miles off Al Shuqaiq, Saudi Arabia",https://www.financialjuice.com/News/9689543/UKMTO-Incident-reported-70-nautical-miles-off-Al-Shuqaiq-Saudi-Arabia.aspx
9689544,2026-07-22 17:11:35,2026-07-22 21:11:35,2026-07-22 21:41:34,1799.4,UKMTO: tanker master reports hit by unidentified projectile causing onboard fire crew are battling,https://www.financialjuice.com/News/9689544/UKMTO-tanker-master-reports-hit-by-unidentified-projectile-causing-onboard-fire-crew-are-battling.aspx
9689545,2026-07-22 17:11:49,2026-07-22 21:11:49,2026-07-22 21:41:34,1785.4,UKMTO: no reported casualties or environmental damage,https://www.financialjuice.com/News/9689545/UKMTO-no-reported-casualties-or-environmental-damage.aspx
9689571,2026-07-22 17:37:16,2026-07-22 21:37:16,2026-07-22 21:41:34,258.4,Russian gas shipments to stay exempt as EU approaches new sanctions agreement: FT,https://www.financialjuice.com/News/9689571/Russian-gas-shipments-to-stay-exempt-as-EU-approaches-new-sanctions-agreement-FT.aspx
9689572,2026-07-22 17:39:06,2026-07-22 21:39:06,2026-07-22 21:41:34,148.4,"Dynagas to keep transporting Russian LNG under new EU sanctions on Moscow, FT says",https://www.financialjuice.com/News/9689572/Dynagas-to-keep-transporting-Russian-LNG-under-new-EU-sanctions-on-Moscow-FT-says.aspx
9689573,2026-07-22 17:40:41,2026-07-22 21:40:41,2026-07-22 21:41:34,53.4,UK PM Burnham names Jo White parliamentary under-secretary of state at Home Office,https://www.financialjuice.com/News/9689573/UK-PM-Burnham-names-Jo-White-parliamentary-under-secretary-of-state-at-Home-Office.aspx
9689588,2026-07-22 17:56:19,2026-07-22 21:56:19,2026-07-23 06:43:57,31658.9,IMF's Katz: eager to visit San Salvador soon,https://www.financialjuice.com/News/9689588/IMFs-Katz-eager-to-visit-San-Salvador-soon.aspx?xy=rss
9689589,2026-07-22 17:57:05,2026-07-22 21:57:05,2026-07-23 06:43:57,31612.9,Kuwaiti army: air defenses are currently intercepting hostile Iranian drone threats,https://www.financialjuice.com/News/9689589/Kuwaiti-army-air-defenses-are-currently-intercepting-hostile-Iranian-drone-threats.aspx?xy=rss
9689590,2026-07-22 17:57:37,2026-07-22 21:57:37,2026-07-23 06:43:57,31580.9,IMF's Katz: Advancing Toward Completion of Upcoming program reviews for El Salvador,https://www.financialjuice.com/News/9689590/IMFs-Katz-Advancing-Toward-Completion-of-Upcoming-program-reviews-for-El-Salvador.aspx?xy=rss
9689611,2026-07-22 18:04:31,2026-07-22 22:04:31,2026-07-23 06:43:57,31166.9,U.S. forces launch fresh strikes against Iran on Wednesday: U.S. Central Command,https://www.financialjuice.com/News/9689611/US-forces-launch-fresh-strikes-against-Iran-on-Wednesday-US-Central-Command.aspx?xy=rss
9689615,2026-07-22 18:44:29,2026-07-22 22:44:29,2026-07-23 06:43:57,28768.9,U.S. probes Chinese AI firm Moonshot for unauthorized chip access - The Information,https://www.financialjuice.com/News/9689615/US-probes-Chinese-AI-firm-Moonshot-for-unauthorized-chip-access---The-Information.aspx?xy=rss
9689634,2026-07-22 19:00:00,2026-07-22 23:00:00,2026-07-23 06:43:57,27837.9,"S. Korean GDP YoY Adv. Actual 3.7% (Forecast 3.5%, Previous 3.8%)",https://www.financialjuice.com/News/9689634/S-Korean-GDP-YoY-Adv-Actual-37-Forecast-35-Previous-38.aspx?xy=rss
9689635,2026-07-22 19:00:00,2026-07-22 23:00:00,2026-07-23 06:43:57,27837.9,"S. Korean GDP QoQ Adv. Actual 0.6% (Forecast 0.4%, Previous 1.8%)",https://www.financialjuice.com/News/9689635/S-Korean-GDP-QoQ-Adv-Actual-06-Forecast-04-Previous-18.aspx?xy=rss
9689637,2026-07-22 19:00:03,2026-07-22 23:00:03,2026-07-23 06:43:57,27834.9,S. Korea Q2 facility spending rises 0.2% quarter on quarter: central bank estimate,https://www.financialjuice.com/News/9689637/S-Korea-Q2-facility-spending-rises-02-quarter-on-quarter-central-bank-estimate.aspx?xy=rss
9689638,2026-07-22 19:00:03,2026-07-22 23:00:03,2026-07-23 06:43:57,27834.9,S.Korea Q2 GDP rises 3.7% y/y: Central bank estimate beats poll of 3.5%,https://www.financialjuice.com/News/9689638/SKorea-Q2-GDP-rises-37-yy-Central-bank-estimate-beats-poll-of-35.aspx?xy=rss
9689647,2026-07-22 19:03:49,2026-07-22 23:03:49,2026-07-23 06:43:57,27608.9,Amazon probed for Chinese influence by US Senate committee,https://www.financialjuice.com/News/9689647/Amazon-probed-for-Chinese-influence-by-US-Senate-committee.aspx?xy=rss
9689636,2026-07-22 19:50:03,2026-07-22 23:50:03,2026-07-23 06:43:57,24834.9,Iran's Revolutionary Guards: one of three oil tankers caught fire after explosion south of Strait of Hormuz,https://www.financialjuice.com/News/9689636/Irans-Revolutionary-Guards-one-of-three-oil-tankers-caught-fire-after-explosion-south-of-Strait-of-Hormuz.aspx?xy=rss
9689640,2026-07-22 19:50:03,2026-07-22 23:50:03,2026-07-23 06:43:57,24834.9,Iran's Revolutionary Guards: two other tankers turned back after incident south of Strait of Hormuz,https://www.financialjuice.com/News/9689640/Irans-Revolutionary-Guards-two-other-tankers-turned-back-after-incident-south-of-Strait-of-Hormuz.aspx?xy=rss
9689639,2026-07-22 19:50:43,2026-07-22 23:50:43,2026-07-23 06:43:57,24794.9,Iran's Revolutionary Guards: no tanker will enter or leave Strait of Hormuz without coordination with Iran,https://www.financialjuice.com/News/9689639/Irans-Revolutionary-Guards-no-tanker-will-enter-or-leave-Strait-of-Hormuz-without-coordination-with-Iran.aspx?xy=rss
9689693,2026-07-22 20:04:17,2026-07-23 00:04:17,2026-07-23 06:43:57,23980.9,"Iran's Mehr cites Khouzestan security official: U.S. missile strike near Shalamcheh border crossing passenger terminal, no injuries",https://www.financialjuice.com/News/9689693/Irans-Mehr-cites-Khouzestan-security-official-US-missile-strike-near-Shalamcheh-border-crossing-passenger-terminal-no-injuries.aspx?xy=rss
9689696,2026-07-22 20:13:29,2026-07-23 00:13:29,2026-07-23 06:43:57,23428.9,China PBOC to set yuan midpoint at 6.7712 per dollar: estimate,https://www.financialjuice.com/News/9689696/China-PBOC-to-set-yuan-midpoint-at-67712-per-dollar-estimate.aspx?xy=rss
9689697,2026-07-22 20:14:19,2026-07-23 00:14:19,2026-07-23 06:43:57,23378.9,Iran's SN cites security official: two killed in U.S. strike at Shalamcheh border crossing,https://www.financialjuice.com/News/9689697/Irans-SN-cites-security-official-two-killed-in-US-strike-at-Shalamcheh-border-crossing.aspx?xy=rss
9689730,2026-07-22 21:00:23,2026-07-23 01:00:23,2026-07-23 06:43:57,20614.9,Taiwan overnight interbank rate starts at 0.805% vs prior session open at 0.805%,https://www.financialjuice.com/News/9689730/Taiwan-overnight-interbank-rate-starts-at-0805-vs-prior-session-open-at-0805.aspx?xy=rss
9689734,2026-07-22 21:02:58,2026-07-23 01:02:58,2026-07-23 06:43:57,20459.9,Japan FinMin Katayama: declines to discuss particular forex levels,https://www.financialjuice.com/News/9689734/Japan-FinMin-Katayama-declines-to-discuss-particular-forex-levels.aspx?xy=rss
9689736,2026-07-22 21:03:28,2026-07-23 01:03:28,2026-07-23 06:43:57,20429.9,Japan Finance Minister Katayama: prepared to take decisive steps on forex if necessary,https://www.financialjuice.com/News/9689736/Japan-Finance-Minister-Katayama-prepared-to-take-decisive-steps-on-forex-if-necessary.aspx?xy=rss
9689755,2026-07-22 21:17:09,2026-07-23 01:17:09,2026-07-23 06:43:57,19608.9,"China sets yuan midpoint at strongest level since February 10, 2023",https://www.financialjuice.com/News/9689755/China-sets-yuan-midpoint-at-strongest-level-since-February-10-2023.aspx?xy=rss
9689756,2026-07-22 21:17:09,2026-07-23 01:17:09,2026-07-23 06:43:57,19608.9,Kodea 0? private consumption can increase 40.4%: crank estimate,https://www.financialjuice.com/News/9689756/Kodea-0-private-consumption-can-increase-404-crank-estimate.aspx?xy=rss
9689757,2026-07-22 21:21:01,2026-07-23 01:21:01,2026-07-23 06:43:57,19376.9,China central bank injects 204 billion yuan through 7-day reverse repos at 1.40%: statement,https://www.financialjuice.com/News/9689757/China-central-bank-injects-204-billion-yuan-through-7-day-reverse-repos-at-140-statement.aspx?xy=rss
9689758,2026-07-22 21:21:01,2026-07-23 01:21:01,2026-07-23 06:43:57,19376.9,"South Korea QOQ GDP up 2.7% year on year, below central bank estimate of 32.5%",https://www.financialjuice.com/News/9689758/South-Korea-QOQ-GDP-up-27-year-on-year-below-central-bank-estimate-of-325.aspx?xy=rss
9689759,2026-07-22 21:30:01,2026-07-23 01:30:01,2026-07-23 06:43:57,18836.9,"Australian Full Time Employment Chg. Actual 29.3k (Forecast -, Previous 5.2k)",https://www.financialjuice.com/News/9689759/Australian-Full-Time-Employment-Chg-Actual-293k-Forecast---Previous-52k.aspx?xy=rss
9689760,2026-07-22 21:30:01,2026-07-23 01:30:01,2026-07-23 06:43:57,18836.9,"Australian Participation Rate Actual 67% (Forecast 66.7%, Previous 66.7%)",https://www.financialjuice.com/News/9689760/Australian-Participation-Rate-Actual-67-Forecast-667-Previous-667.aspx?xy=rss
9689762,2026-07-22 21:30:02,2026-07-23 01:30:02,2026-07-23 06:43:57,18835.9,"Australian Unemployment Rate Actual 4.4% (Forecast 4.4%, Previous 4.4%)",https://www.financialjuice.com/News/9689762/Australian-Unemployment-Rate-Actual-44-Forecast-44-Previous-44.aspx?xy=rss
9689764,2026-07-22 21:30:04,2026-07-23 01:30:04,2026-07-23 06:43:57,18833.9,"Australia June full-time jobs rise 29,300 seasonally adjusted",https://www.financialjuice.com/News/9689764/Australia-June-full-time-jobs-rise-29300-seasonally-adjusted.aspx?xy=rss
9689765,2026-07-22 21:30:04,2026-07-23 01:30:04,2026-07-23 06:43:57,18833.9,"Australia June unemployment rate rises to 4.4%, survey matches forecasts",https://www.financialjuice.com/News/9689765/Australia-June-unemployment-rate-rises-to-44-survey-matches-forecasts.aspx?xy=rss
9689766,2026-07-22 21:30:04,2026-07-23 01:30:04,2026-07-23 06:43:57,18833.9,"Australia June participation rate rises 67.0%, seasonally adjusted (Poll: 66.7%)",https://www.financialjuice.com/News/9689766/Australia-June-participation-rate-rises-670-seasonally-adjusted-Poll-667.aspx?xy=rss
9689767,2026-07-22 21:30:04,2026-07-23 01:30:04,2026-07-23 06:43:57,18833.9,"Australia June employment rises 76,300 vs poll 15,300",https://www.financialjuice.com/News/9689767/Australia-June-employment-rises-76300-vs-poll-15300.aspx?xy=rss
9689761,2026-07-22 21:30:23,2026-07-23 01:30:23,2026-07-23 06:43:57,18814.9,"Australian Employment Change Actual 76.3k (Forecast 15k, Previous 40.3k)",https://www.financialjuice.com/News/9689761/Australian-Employment-Change-Actual-763k-Forecast-15k-Previous-403k.aspx?xy=rss
9689773,2026-07-22 21:31:35,2026-07-23 01:31:35,2026-07-23 06:43:57,18742.9,Two Chinese supertankers loaded with Saudi crude approach Bab el-Mandeb Strait for Red Sea exit: data,https://www.financialjuice.com/News/9689773/Two-Chinese-supertankers-loaded-with-Saudi-crude-approach-Bab-el-Mandeb-Strait-for-Red-Sea-exit-data.aspx?xy=rss
9689789,2026-07-22 21:36:22,2026-07-23 01:36:22,2026-07-23 06:43:57,18455.9,"Saudi-owned vessel Encelia attacked in Red Sea, fire erupts at bow; crew unharmed - Saudi state news agency",https://www.financialjuice.com/News/9689789/Saudi-owned-vessel-Encelia-attacked-in-Red-Sea-fire-erupts-at-bow-crew-unharmed---Saudi-state-news-agency.aspx?xy=rss
9689800,2026-07-22 21:56:05,2026-07-23 01:56:05,2026-07-23 06:43:57,17272.9,Moderate Amish Shah takes Democratic primary for Arizona’s 1st District U.S. House seat: Decision Desk HQ projects,https://www.financialjuice.com/News/9689800/Moderate-Amish-Shah-takes-Democratic-primary-for-Arizonas-1st-District-US-House-seat-Decision-Desk-HQ-projects.aspx?xy=rss
9689896,2026-07-22 22:10:18,2026-07-23 02:10:18,2026-07-23 06:43:57,16419.9,Amish Shah clinches Democratic nomination for U.S. House in Arizona's 1st congressional district - AP News,https://www.financialjuice.com/News/9689896/Amish-Shah-clinches-Democratic-nomination-for-US-House-in-Arizonas-1st-congressional-district---AP-News.aspx?xy=rss
9689897,2026-07-22 22:47:41,2026-07-23 02:47:41,2026-07-23 06:43:57,14176.9,US military: latest round of strikes on Iran completed,https://www.financialjuice.com/News/9689897/US-military-latest-round-of-strikes-on-Iran-completed.aspx?xy=rss
9689898,2026-07-22 22:47:50,2026-07-23 02:47:50,2026-07-23 06:43:57,14167.9,US Central Command: US forces complete 12th consecutive night of strikes against Iran,https://www.financialjuice.com/News/9689898/US-Central-Command-US-forces-complete-12th-consecutive-night-of-strikes-against-Iran.aspx?xy=rss
9689927,2026-07-22 23:21:36,2026-07-23 03:21:36,2026-07-23 06:43:57,12141.9,"Intel, AMD ink long-term server CPU agreements with Chinese buyers: sources",https://www.financialjuice.com/News/9689927/Intel-AMD-ink-long-term-server-CPU-agreements-with-Chinese-buyers-sources.aspx?xy=rss
9689938,2026-07-22 23:38:54,2026-07-23 03:38:54,2026-07-23 06:43:57,11103.9,"India PM Modi: to establish fast-track courts for rapid, strict punishment for paper leak offenders",https://www.financialjuice.com/News/9689938/India-PM-Modi-to-establish-fast-track-courts-for-rapid-strict-punishment-for-paper-leak-offenders.aspx?xy=rss
9689939,2026-07-22 23:39:11,2026-07-23 03:39:11,2026-07-23 06:43:57,11086.9,India PM Modi: directs authorities and officials to take all necessary measures,https://www.financialjuice.com/News/9689939/India-PM-Modi-directs-authorities-and-officials-to-take-all-necessary-measures.aspx?xy=rss
9689985,2026-07-23 00:05:04,2026-07-23 04:05:04,2026-07-23 06:43:57,9533.9,"Poll: dollar/yen near 160 level overvalued versus Japan’s economic fundamentals, say 79% of economists",https://www.financialjuice.com/News/9689985/Poll-dollaryen-near-160-level-overvalued-versus-Japans-economic-fundamentals-say-79-of-economists.aspx?xy=rss
9689986,2026-07-23 00:05:04,2026-07-23 04:05:04,2026-07-23 06:43:57,9533.9,"Poll: BOJ to increase rates to minimum 1.50% in Q2 2027, 70% of economists say; 51% expect 1.50% terminal rate",https://www.financialjuice.com/News/9689986/Poll-BOJ-to-increase-rates-to-minimum-150-in-Q2-2027-70-of-economists-say-51-expect-150-terminal-rate.aspx?xy=rss
9689987,2026-07-23 00:05:04,2026-07-23 04:05:04,2026-07-23 06:43:57,9533.9,"Poll: Bank of Japan to lift key interest rate to 1.25% by end-24, say 86% of economists vs 79% in June survey",https://www.financialjuice.com/News/9689987/Poll-Bank-of-Japan-to-lift-key-interest-rate-to-125-by-end-24-say-86-of-economists-vs-79-in-June-survey.aspx?xy=rss
9689988,2026-07-23 00:05:04,2026-07-23 04:05:04,2026-07-23 06:43:57,9533.9,Poll: 58% of economists find impact of JGB yield rise on Japan’s debt-financing costs in next 2-3 years very or somewhat worrying,https://www.financialjuice.com/News/9689988/Poll-58-of-economists-find-impact-of-JGB-yield-rise-on-Japans-debt-financing-costs-in-next-2-3-years-very-or-somewhat-worrying.aspx?xy=rss
9689998,2026-07-23 00:30:00,2026-07-23 04:30:00,2026-07-23 06:43:57,8037.9,"Dutch Consumer Confidence Adjusted Actual -35 (Forecast -, Previous -39)",https://www.financialjuice.com/News/9689998/Dutch-Consumer-Confidence-Adjusted-Actual--35-Forecast---Previous--39.aspx?xy=rss
9689999,2026-07-23 00:30:03,2026-07-23 04:30:03,2026-07-23 06:43:57,8034.9,Dutch July consumer confidence -35 after -39 in June: CBS,https://www.financialjuice.com/News/9689999/Dutch-July-consumer-confidence--35-after--39-in-June-CBS.aspx?xy=rss
9690030,2026-07-23 01:13:51,2026-07-23 05:13:51,2026-07-23 06:43:57,5406.9,Saudi ship Encelia targeted while sailing the Red Sea - SPA,https://www.financialjuice.com/News/9690030/Saudi-ship-Encelia-targeted-while-sailing-the-Red-Sea---SPA.aspx?xy=rss
9690056,2026-07-23 01:35:01,2026-07-23 05:35:01,2026-07-23 06:43:57,4136.9,Iran targeted US Missile defenses and radar in Jordan - Tasnim,https://www.financialjuice.com/News/9690056/Iran-targeted-US-Missile-defenses-and-radar-in-Jordan---Tasnim.aspx?xy=rss
9690090,2026-07-23 02:22:07,2026-07-23 06:22:07,2026-07-23 06:43:57,1310.9,30-Day Correlation Matrix,https://www.financialjuice.com/News/9690090/30-Day-Correlation-Matrix.aspx?xy=rss
9690091,2026-07-23 02:22:25,2026-07-23 06:22:25,2026-07-23 06:43:57,1292.9,60-Day Correlation Matrix,https://www.financialjuice.com/News/9690091/60-Day-Correlation-Matrix.aspx?xy=rss
9690092,2026-07-23 02:22:47,2026-07-23 06:22:47,2026-07-23 06:43:57,1270.9,90-Day Correlation Matrix,https://www.financialjuice.com/News/9690092/90-Day-Correlation-Matrix.aspx?xy=rss
9690093,2026-07-23 02:23:05,2026-07-23 06:23:05,2026-07-23 06:43:57,1252.9,120-Day Correlation Matrix,https://www.financialjuice.com/News/9690093/120-Day-Correlation-Matrix.aspx?xy=rss
9690094,2026-07-23 02:23:57,2026-07-23 06:23:57,2026-07-23 06:43:57,1200.9,Top S&P 500 Stock Names Implied Volatility,https://www.financialjuice.com/News/9690094/Top-SP-500-Stock-Names-Implied-Volatility.aspx?xy=rss
9690095,2026-07-23 02:24:21,2026-07-23 06:24:21,2026-07-23 06:43:57,1176.9,US Index Futures Implied Volatility,https://www.financialjuice.com/News/9690095/US-Index-Futures-Implied-Volatility.aspx?xy=rss
9690096,2026-07-23 02:24:37,2026-07-23 06:24:37,2026-07-23 06:43:57,1160.9,FX Implied Volatility,https://www.financialjuice.com/News/9690096/FX-Implied-Volatility.aspx?xy=rss
9690097,2026-07-23 02:24:56,2026-07-23 06:24:56,2026-07-23 06:43:57,1141.9,Commodities Implied Volatility,https://www.financialjuice.com/News/9690097/Commodities-Implied-Volatility.aspx?xy=rss
9690098,2026-07-23 02:25:38,2026-07-23 06:25:38,2026-07-23 06:43:57,1099.9,Fed Interest Rate Probabilities,https://www.financialjuice.com/News/9690098/Fed-Interest-Rate-Probabilities.aspx?xy=rss
9690099,2026-07-23 02:26:00,2026-07-23 06:26:00,2026-07-23 06:43:57,1077.9,ECB Interest Rate Probabilities,https://www.financialjuice.com/News/9690099/ECB-Interest-Rate-Probabilities.aspx?xy=rss
9690100,2026-07-23 02:26:19,2026-07-23 06:26:19,2026-07-23 06:43:57,1058.9,BoE Interest Rate Probabilities,https://www.financialjuice.com/News/9690100/BoE-Interest-Rate-Probabilities.aspx?xy=rss
9690101,2026-07-23 02:26:41,2026-07-23 06:26:41,2026-07-23 06:43:57,1036.9,BoC Interest Rate Probabilities,https://www.financialjuice.com/News/9690101/BoC-Interest-Rate-Probabilities.aspx?xy=rss
9690102,2026-07-23 02:26:56,2026-07-23 06:26:56,2026-07-23 06:43:57,1021.9,BoJ Interest Rate Probabilities,https://www.financialjuice.com/News/9690102/BoJ-Interest-Rate-Probabilities.aspx?xy=rss
9690103,2026-07-23 02:27:14,2026-07-23 06:27:14,2026-07-23 06:43:57,1003.9,RBA Interest Rate Probabilities,https://www.financialjuice.com/News/9690103/RBA-Interest-Rate-Probabilities.aspx?xy=rss
9690104,2026-07-23 02:27:31,2026-07-23 06:27:31,2026-07-23 06:43:57,986.9,RBNZ Interest Rate Probabilities,https://www.financialjuice.com/News/9690104/RBNZ-Interest-Rate-Probabilities.aspx?xy=rss
9690105,2026-07-23 02:27:52,2026-07-23 06:27:52,2026-07-23 06:43:57,965.9,SNB Interest Rate Probabilities,https://www.financialjuice.com/News/9690105/SNB-Interest-Rate-Probabilities.aspx?xy=rss
9690115,2026-07-23 02:45:00,2026-07-23 06:45:00,2026-07-23 12:14:12,19752.8,"French Business Climate Mfg Actual 101 (Forecast 101, Previous 100)",https://www.financialjuice.com/News/9690115/French-Business-Climate-Mfg-Actual-101-Forecast-101-Previous-100.aspx
9690116,2026-07-23 02:45:00,2026-07-23 06:45:00,2026-07-23 12:14:12,19752.8,"French Business Climate Overall Actual 97 (Forecast 95, Previous 94)",https://www.financialjuice.com/News/9690116/French-Business-Climate-Overall-Actual-97-Forecast-95-Previous-94.aspx
9690133,2026-07-23 02:59:30,2026-07-23 06:59:30,2026-07-23 12:14:12,18882.8,The US struck Eslamabad-e Gharb in western Iran early Thursday - ISNA,https://www.financialjuice.com/News/9690133/The-US-struck-Eslamabad-e-Gharb-in-western-Iran-early-Thursday---ISNA.aspx
9690160,2026-07-23 03:06:23,2026-07-23 07:06:23,2026-07-23 12:14:12,18469.8,UK Finance Minister Healey: I am as concerned about the cost of business as I am about the cost of living,https://www.financialjuice.com/News/9690160/UK-Finance-Minister-Healey-I-am-as-concerned-about-the-cost-of-business-as-I-am-about-the-cost-of-living.aspx
9690161,2026-07-23 03:08:14,2026-07-23 07:08:14,2026-07-23 12:14:12,18358.8,"Currency Strength Chart: Strongest: CAD, EUR, AUD, JPY, USD, CHF, GBP, NZD - Weakest",https://www.financialjuice.com/News/9690161/Currency-Strength-Chart-Strongest-CAD-EUR-AUD-JPY-USD-CHF-GBP-NZD---Weakest.aspx
9690162,2026-07-23 03:09:51,2026-07-23 07:09:51,2026-07-23 12:14:12,18261.8,UK Finance Minister Healey on business support: I know we've got a lot further to go,https://www.financialjuice.com/News/9690162/UK-Finance-Minister-Healey-on-business-support-I-know-weve-got-a-lot-further-to-go.aspx
9690163,2026-07-23 03:10:15,2026-07-23 07:10:15,2026-07-23 12:14:12,18237.8,UK Finance Minister Healey: Want to deepen the government's relationship with business,https://www.financialjuice.com/News/9690163/UK-Finance-Minister-Healey-Want-to-deepen-the-governments-relationship-with-business.aspx
9690164,2026-07-23 03:11:48,2026-07-23 07:11:48,2026-07-23 12:14:12,18144.8,EU countries agree to freeze the Russia oil price cap for 12 months,https://www.financialjuice.com/News/9690164/EU-countries-agree-to-freeze-the-Russia-oil-price-cap-for-12-months.aspx
9690165,2026-07-23 03:15:04,2026-07-23 07:15:04,2026-07-23 12:14:12,17948.8,EU envoys agree on an exemption for Russian LNG transfer to third countries for one year with automatic renewal - EU diplomats,https://www.financialjuice.com/News/9690165/EU-envoys-agree-on-an-exemption-for-Russian-LNG-transfer-to-third-countries-for-one-year-with-automatic-renewal---EU-diplomats.aspx
9690199,2026-07-23 03:45:46,2026-07-23 07:45:46,2026-07-23 12:14:12,16106.8,"China, US working on tariff cut plan agreed during summit.",https://www.financialjuice.com/News/9690199/China-US-working-on-tariff-cut-plan-agreed-during-summit.aspx
9690200,2026-07-23 03:46:29,2026-07-23 07:46:29,2026-07-23 12:14:12,16063.8,"China, US maintain close communication on tariff cuts - MofCom.",https://www.financialjuice.com/News/9690200/China-US-maintain-close-communication-on-tariff-cuts---MofCom.aspx
9690218,2026-07-23 03:47:21,2026-07-23 07:47:21,2026-07-23 12:14:12,16011.8,Traders fully price two quarter-point ECB hikes by year-end.,https://www.financialjuice.com/News/9690218/Traders-fully-price-two-quarter-point-ECB-hikes-by-year-end.aspx
9690219,2026-07-23 03:48:23,2026-07-23 07:48:23,2026-07-23 12:14:12,15949.8,"Traders boost BoE bets, fully price 75bps of hikes by mid-2027.",https://www.financialjuice.com/News/9690219/Traders-boost-BoE-bets-fully-price-75bps-of-hikes-by-mid-2027.aspx
9690220,2026-07-23 03:51:43,2026-07-23 07:51:43,2026-07-23 12:14:12,15749.8,US Secretary of State Rubio: Iran was intending to double missile stockpile.,https://www.financialjuice.com/News/9690220/US-Secretary-of-State-Rubio-Iran-was-intending-to-double-missile-stockpile.aspx
9690221,2026-07-23 03:54:34,2026-07-23 07:54:34,2026-07-23 12:14:12,15578.8,US Secretary of State Rubio: Looks like Iran not ready to make a deal.,https://www.financialjuice.com/News/9690221/US-Secretary-of-State-Rubio-Looks-like-Iran-not-ready-to-make-a-deal.aspx
9690222,2026-07-23 03:54:59,2026-07-23 07:54:59,2026-07-23 12:14:12,15553.8,US Secretary of State Rubio: Iran begging us every day to make a deal.,https://www.financialjuice.com/News/9690222/US-Secretary-of-State-Rubio-Iran-begging-us-every-day-to-make-a-deal.aspx
9690234,2026-07-23 04:07:56,2026-07-23 08:07:56,2026-07-23 12:14:12,14776.8,Equinor Asa: UBS lifts target price to NOK 380 from NOK 340,https://www.financialjuice.com/News/9690234/Equinor-Asa-UBS-lifts-target-price-to-NOK-380-from-NOK-340.aspx
9690255,2026-07-23 04:18:01,2026-07-23 08:18:01,2026-07-23 12:14:12,14171.8,Europe Sentiment: Was Alphabet's Performance Enough? - FJElite,https://www.financialjuice.com/News/9690255/Europe-Sentiment-Was-Alphabets-Performance-Enough---FJElite.aspx
9690295,2026-07-23 04:51:45,2026-07-23 08:51:45,2026-07-23 12:14:12,12147.8,MUFG: The EUR - FJElite,https://www.financialjuice.com/News/9690295/MUFG-The-EUR---FJElite.aspx
9690296,2026-07-23 04:53:07,2026-07-23 08:53:07,2026-07-23 12:14:12,12065.8,ING: The AUD - FJElite,https://www.financialjuice.com/News/9690296/ING-The-AUD---FJElite.aspx
9690319,2026-07-23 05:11:03,2026-07-23 09:11:03,2026-07-23 12:14:12,10989.8,Oman: Coordinating with Saudis and Yemenis on resuming diplomacy,https://www.financialjuice.com/News/9690319/Oman-Coordinating-with-Saudis-and-Yemenis-on-resuming-diplomacy.aspx
9690320,2026-07-23 05:11:22,2026-07-23 09:11:22,2026-07-23 12:14:12,10970.8,Sirens sound in Bahrain - Interior Ministry,https://www.financialjuice.com/News/9690320/Sirens-sound-in-Bahrain---Interior-Ministry.aspx
9690354,2026-07-23 05:31:41,2026-07-23 09:31:41,2026-07-23 12:14:12,9751.8,Kremlin: We continue dialogue with the US via working channels and hope US representatives will come here when they are available,https://www.financialjuice.com/News/9690354/Kremlin-We-continue-dialogue-with-the-US-via-working-channels-and-hope-US-representatives-will-come-here-when-they-are-available.aspx
9690374,2026-07-23 06:00:00,2026-07-23 10:00:00,2026-07-23 12:14:12,8052.8,"UK CBI Orders Actual -45 (Forecast -40, Previous -45)",https://www.financialjuice.com/News/9690374/UK-CBI-Orders-Actual--45-Forecast--40-Previous--45.aspx
